<?xml version="1.0" encoding="UTF-8"?>
<xsd:schema xmlns:xsd="http://www.w3.org/2001/XMLSchema" xmlns:od="urn:schemas-microsoft-com:officedata">
<xsd:element name="dataroot">
<xsd:complexType>
<xsd:sequence>
<xsd:element ref="Skill" minOccurs="0" maxOccurs="unbounded"/>
</xsd:sequence>
<xsd:attribute name="generated" type="xsd:dateTime"/>
</xsd:complexType>
</xsd:element>
<xsd:element name="Skill">
<xsd:annotation>
<xsd:appinfo>
<od:tableProperty name="PublishToWeb" type="2" value="1"/>
<od:tableProperty name="GUID" type="9" value="9KomhwM8PkmadAPowaYfUg==
"/>
<od:tableProperty name="Orientation" type="2" value="0"/>
<od:tableProperty name="OrderByOn" type="1" value="1"/>
<od:tableProperty name="NameMap" type="11" value="CswOVQAAAAD0qiaHAzw+SZp0A+jBph9SAAAAAMhBCYsaf+RAAAAAAAAAAABTAGsA
aQBsAGwAAAAAAAAAzkRbs8LSDUufdJ10h5csxwcAAAD0qiaHAzw+SZp0A+jBph9S
SQBEAAAAAAAAAKkWdPxzDUdAj+aIEp3iMc0HAAAA9KomhwM8PkmadAPowaYfUk4A
YQBtAGUAAAAAAAAArkMi9DOqLEmMnMkVImgYLAcAAAD0qiaHAzw+SZp0A+jBph9S
QgBhAHMAZQAgAFAAbwB3AGUAcgAAAAAAAAA9ofPj5UHbR7W8Gsb3pSiOBwAAAPSq
JocDPD5JmnQD6MGmH1JFAGwAZQBtAGUAbgB0AAAAAAAAAKdQVaZm0/lGte4QEr10
oScHAAAA9KomhwM8PkmadAPowaYfUlQAeQBwAGUAAAAAAAAAz+w3eJhBa0etqe8a
HNDUKQcAAAD0qiaHAzw+SZp0A+jBph9SVABhAHIAZwBlAHQAAAAAAAAATfck9Kdx
sUamWsskCJ3CcQcAAAD0qiaHAzw+SZp0A+jBph9STQBQACAAQwBvAHMAdAAAAAAA
AAAOUcSocmpFQ54/WD4hcsQnBwAAAPSqJocDPD5JmnQD6MGmH1JEAGUAcwBjAHIA
aQBwAHQAaQBvAG4AAAAAAAAAAAAAAAAAAAAAAAAAAAAAAAwAAAAFAAAAAAAAAAAA
AAAAAAAAAAA=
"/>
<od:tableProperty name="DefaultView" type="2" value="2"/>
<od:tableProperty name="DisplayViewsOnSharePointSite" type="2" value="1"/>
<od:tableProperty name="TotalsRow" type="1" value="0"/>
<od:tableProperty name="FilterOnLoad" type="1" value="0"/>
<od:tableProperty name="OrderByOnLoad" type="1" value="1"/>
<od:tableProperty name="HideNewField" type="1" value="0"/>
<od:tableProperty name="BackTint" type="6" value="100"/>
<od:tableProperty name="BackShade" type="6" value="100"/>
<od:tableProperty name="ThemeFontIndex" type="4" value="1"/>
<od:tableProperty name="AlternateBackThemeColorIndex" type="4" value="1"/>
<od:tableProperty name="AlternateBackTint" type="6" value="100"/>
<od:tableProperty name="AlternateBackShade" type="6" value="95"/>
<od:tableProperty name="ReadOnlyWhenDisconnected" type="1" value="0"/>
<od:tableProperty name="DatasheetGridlinesThemeColorIndex" type="4" value="3"/>
<od:tableProperty name="DatasheetForeThemeColorIndex" type="4" value="0"/>
<od:tableProperty name="OrderBy" type="12" value="[Skill].[ID]"/>
</xsd:appinfo>
</xsd:annotation>
<xsd:complexType>
<xsd:sequence>
<xsd:element name="ID" minOccurs="0" od:jetType="text" od:sqlSType="nvarchar">
<xsd:annotation>
<xsd:appinfo>
<od:fieldProperty name="ColumnWidth" type="3" value="-1"/>
<od:fieldProperty name="ColumnOrder" type="3" value="1"/>
<od:fieldProperty name="ColumnHidden" type="1" value="0"/>
<od:fieldProperty name="Required" type="1" value="0"/>
<od:fieldProperty name="AllowZeroLength" type="1" value="1"/>
<od:fieldProperty name="DisplayControl" type="3" value="109"/>
<od:fieldProperty name="IMEMode" type="2" value="1"/>
<od:fieldProperty name="IMESentenceMode" type="2" value="0"/>
<od:fieldProperty name="UnicodeCompression" type="1" value="0"/>
<od:fieldProperty name="TextAlign" type="2" value="0"/>
<od:fieldProperty name="AggregateType" type="4" value="-1"/>
<od:fieldProperty name="ResultType" type="2" value="0"/>
<od:fieldProperty name="CurrencyLCID" type="4" value="0"/>
<od:fieldProperty name="GUID" type="9" value="zkRbs8LSDUufdJ10h5csxw==
"/>
</xsd:appinfo>
</xsd:annotation>
<xsd:simpleType>
<xsd:restriction base="xsd:string">
<xsd:maxLength value="255"/>
</xsd:restriction>
</xsd:simpleType>
</xsd:element>
<xsd:element name="Name" minOccurs="0" od:jetType="text" od:sqlSType="nvarchar">
<xsd:annotation>
<xsd:appinfo>
<od:fieldProperty name="GUID" type="9" value="qRZ0/HMNR0CP5ogSneIxzQ==
"/>
<od:fieldProperty name="ColumnWidth" type="3" value="2052"/>
<od:fieldProperty name="ColumnOrder" type="3" value="2"/>
<od:fieldProperty name="ColumnHidden" type="1" value="0"/>
<od:fieldProperty name="Required" type="1" value="0"/>
<od:fieldProperty name="AllowZeroLength" type="1" value="1"/>
<od:fieldProperty name="DisplayControl" type="3" value="109"/>
<od:fieldProperty name="IMEMode" type="2" value="1"/>
<od:fieldProperty name="IMESentenceMode" type="2" value="0"/>
<od:fieldProperty name="UnicodeCompression" type="1" value="1"/>
<od:fieldProperty name="TextAlign" type="2" value="0"/>
<od:fieldProperty name="AggregateType" type="4" value="-1"/>
<od:fieldProperty name="ResultType" type="2" value="0"/>
<od:fieldProperty name="CurrencyLCID" type="4" value="0"/>
</xsd:appinfo>
</xsd:annotation>
<xsd:simpleType>
<xsd:restriction base="xsd:string">
<xsd:maxLength value="255"/>
</xsd:restriction>
</xsd:simpleType>
</xsd:element>
<xsd:element name="Base_x0020_Power" minOccurs="0" od:jetType="longinteger" od:sqlSType="int" type="xsd:int">
<xsd:annotation>
<xsd:appinfo>
<od:fieldProperty name="ColumnWidth" type="3" value="-1"/>
<od:fieldProperty name="ColumnOrder" type="3" value="3"/>
<od:fieldProperty name="ColumnHidden" type="1" value="0"/>
<od:fieldProperty name="DecimalPlaces" type="2" value="255"/>
<od:fieldProperty name="Required" type="1" value="0"/>
<od:fieldProperty name="DisplayControl" type="3" value="109"/>
<od:fieldProperty name="TextAlign" type="2" value="0"/>
<od:fieldProperty name="AggregateType" type="4" value="-1"/>
<od:fieldProperty name="ResultType" type="2" value="0"/>
<od:fieldProperty name="CurrencyLCID" type="4" value="0"/>
<od:fieldProperty name="GUID" type="9" value="rkMi9DOqLEmMnMkVImgYLA==
"/>
</xsd:appinfo>
</xsd:annotation>
</xsd:element>
<xsd:element name="Element" minOccurs="0" od:jetType="text" od:sqlSType="nvarchar">
<xsd:annotation>
<xsd:appinfo>
<od:fieldProperty name="ColumnWidth" type="3" value="-1"/>
<od:fieldProperty name="ColumnOrder" type="3" value="4"/>
<od:fieldProperty name="ColumnHidden" type="1" value="0"/>
<od:fieldProperty name="Required" type="1" value="0"/>
<od:fieldProperty name="AllowZeroLength" type="1" value="1"/>
<od:fieldProperty name="DisplayControl" type="3" value="109"/>
<od:fieldProperty name="IMEMode" type="2" value="1"/>
<od:fieldProperty name="IMESentenceMode" type="2" value="0"/>
<od:fieldProperty name="UnicodeCompression" type="1" value="1"/>
<od:fieldProperty name="TextAlign" type="2" value="0"/>
<od:fieldProperty name="AggregateType" type="4" value="-1"/>
<od:fieldProperty name="ResultType" type="2" value="0"/>
<od:fieldProperty name="CurrencyLCID" type="4" value="0"/>
<od:fieldProperty name="GUID" type="9" value="PaHz4+VB20e1vBrG96Uojg==
"/>
</xsd:appinfo>
</xsd:annotation>
<xsd:simpleType>
<xsd:restriction base="xsd:string">
<xsd:maxLength value="255"/>
</xsd:restriction>
</xsd:simpleType>
</xsd:element>
<xsd:element name="Type" minOccurs="0" od:jetType="text" od:sqlSType="nvarchar">
<xsd:annotation>
<xsd:appinfo>
<od:fieldProperty name="ColumnWidth" type="3" value="-1"/>
<od:fieldProperty name="ColumnOrder" type="3" value="5"/>
<od:fieldProperty name="ColumnHidden" type="1" value="0"/>
<od:fieldProperty name="Required" type="1" value="0"/>
<od:fieldProperty name="AllowZeroLength" type="1" value="1"/>
<od:fieldProperty name="DisplayControl" type="3" value="109"/>
<od:fieldProperty name="IMEMode" type="2" value="1"/>
<od:fieldProperty name="IMESentenceMode" type="2" value="0"/>
<od:fieldProperty name="UnicodeCompression" type="1" value="1"/>
<od:fieldProperty name="TextAlign" type="2" value="0"/>
<od:fieldProperty name="AggregateType" type="4" value="-1"/>
<od:fieldProperty name="ResultType" type="2" value="0"/>
<od:fieldProperty name="CurrencyLCID" type="4" value="0"/>
<od:fieldProperty name="GUID" type="9" value="p1BVpmbT+Ua17hASvXShJw==
"/>
</xsd:appinfo>
</xsd:annotation>
<xsd:simpleType>
<xsd:restriction base="xsd:string">
<xsd:maxLength value="255"/>
</xsd:restriction>
</xsd:simpleType>
</xsd:element>
<xsd:element name="Target" minOccurs="0" od:jetType="text" od:sqlSType="nvarchar">
<xsd:annotation>
<xsd:appinfo>
<od:fieldProperty name="ColumnWidth" type="3" value="-1"/>
<od:fieldProperty name="ColumnOrder" type="3" value="6"/>
<od:fieldProperty name="ColumnHidden" type="1" value="0"/>
<od:fieldProperty name="Required" type="1" value="0"/>
<od:fieldProperty name="AllowZeroLength" type="1" value="1"/>
<od:fieldProperty name="DisplayControl" type="3" value="109"/>
<od:fieldProperty name="IMEMode" type="2" value="1"/>
<od:fieldProperty name="IMESentenceMode" type="2" value="0"/>
<od:fieldProperty name="UnicodeCompression" type="1" value="1"/>
<od:fieldProperty name="TextAlign" type="2" value="0"/>
<od:fieldProperty name="AggregateType" type="4" value="-1"/>
<od:fieldProperty name="ResultType" type="2" value="0"/>
<od:fieldProperty name="CurrencyLCID" type="4" value="0"/>
<od:fieldProperty name="GUID" type="9" value="z+w3eJhBa0etqe8aHNDUKQ==
"/>
</xsd:appinfo>
</xsd:annotation>
<xsd:simpleType>
<xsd:restriction base="xsd:string">
<xsd:maxLength value="255"/>
</xsd:restriction>
</xsd:simpleType>
</xsd:element>
<xsd:element name="MP_x0020_Cost" minOccurs="0" od:jetType="longinteger" od:sqlSType="int" type="xsd:int">
<xsd:annotation>
<xsd:appinfo>
<od:fieldProperty name="ColumnWidth" type="3" value="-1"/>
<od:fieldProperty name="ColumnOrder" type="3" value="7"/>
<od:fieldProperty name="ColumnHidden" type="1" value="0"/>
<od:fieldProperty name="DecimalPlaces" type="2" value="255"/>
<od:fieldProperty name="Required" type="1" value="0"/>
<od:fieldProperty name="DisplayControl" type="3" value="109"/>
<od:fieldProperty name="TextAlign" type="2" value="0"/>
<od:fieldProperty name="AggregateType" type="4" value="-1"/>
<od:fieldProperty name="ResultType" type="2" value="0"/>
<od:fieldProperty name="CurrencyLCID" type="4" value="0"/>
<od:fieldProperty name="GUID" type="9" value="Tfck9KdxsUamWsskCJ3CcQ==
"/>
</xsd:appinfo>
</xsd:annotation>
</xsd:element>
<xsd:element name="Description" minOccurs="0" od:jetType="text" od:sqlSType="nvarchar">
<xsd:annotation>
<xsd:appinfo>
<od:fieldProperty name="ColumnWidth" type="3" value="9516"/>
<od:fieldProperty name="ColumnOrder" type="3" value="8"/>
<od:fieldProperty name="ColumnHidden" type="1" value="0"/>
<od:fieldProperty name="Required" type="1" value="0"/>
<od:fieldProperty name="AllowZeroLength" type="1" value="1"/>
<od:fieldProperty name="DisplayControl" type="3" value="109"/>
<od:fieldProperty name="IMEMode" type="2" value="1"/>
<od:fieldProperty name="IMESentenceMode" type="2" value="0"/>
<od:fieldProperty name="UnicodeCompression" type="1" value="1"/>
<od:fieldProperty name="TextAlign" type="2" value="0"/>
<od:fieldProperty name="AggregateType" type="4" value="-1"/>
<od:fieldProperty name="ResultType" type="2" value="0"/>
<od:fieldProperty name="CurrencyLCID" type="4" value="0"/>
<od:fieldProperty name="GUID" type="9" value="DlHEqHJqRUOeP1g+IXLEJw==
"/>
</xsd:appinfo>
</xsd:annotation>
<xsd:simpleType>
<xsd:restriction base="xsd:string">
<xsd:maxLength value="255"/>
</xsd:restriction>
</xsd:simpleType>
</xsd:element>
</xsd:sequence>
</xsd:complexType>
</xsd:element>
</xsd:schema>
